{
  "title": "ðŸŽ­ Class & Level",
  "description": "Manage your character's class and level with multiclass support",
  "classEnum": {
    "enumId": "classes"
  },
  "levelField": {
    "label": "Level",
    "min": 1,
    "max": 20,
    "default": 1
  },
  "addButtonText": "Add Class",
  "emptyStateText": "No classes added yet. Click \"Add Class\" to begin.",
  "multiclassInfoTemplate": "ðŸ’¡ **Multiclassing:** You have {count} classes for a total level of **{total}**."
}
